
Specific Building Type Label,Description
WSF1,"Wood, Single-family, One-story"
WSF2,"Wood, Single-family, Two or More Stories"
WMUH1,"Wood, Multi-Unit Housing, One-story"
WMUH2,"Wood, Multi-Unit Housing, Two Stories"
WMUH3,"Wood, Multi-Unit Housing, Three or More Stories"
MSF1,"Masonry, Single-family, One-story"
MSF2,"Masonry, Single-family, Two or More Stories"
MMUH1,"Masonry, Multi-Unit Housing, One-story"
MMUH2,"Masonry, Multi-Unit Housing, Two Stories"
MMUH3,"Masonry, Multi-Unit Housing, Three or More Stories"
MLRM1,"Masonry, Low-Rise Strip Mall, Up to 15 Feet"
MLRM2,"Masonry, Low-Rise Strip Mall, More than 15 Feet"
MLRI,"Masonry, Low-Rise Industrial/Warehouse/Factory Buildings"
MERBL,"Masonry, Engineered Residential Building, Low-Rise (1-2 Stories)"
MERBM,"Masonry, Engineered Residential Building, Mid-Rise (3-5 Stories)"
MERBH,"Masonry, Engineered Residential Building, High-Rise (6+ Stories)"
MECBL,"Masonry, Engineered Commercial Building, Low-Rise (1-2 Stories)"
MECBM,"Masonry, Engineered Commercial Building, Mid-Rise (3-5 Stories)"
MECBH,"Masonry, Engineered Commercial Building, High-Rise (6+ Stories)"
CERBL,"Concrete, Engineered Residential Building, Low-Rise (1-2 Stories)"
CERBM,"Concrete, Engineered Residential Building, Mid-Rise (3-5 Stories)"
CERBH,"Concrete, Engineered Residential Building, High-Rise (6+ Stories)"
CECBL,"Concrete, Engineered Commercial Building, Low-Rise (1-2 Stories)"
CECBM,"Concrete, Engineered Commercial Building, Mid-Rise (3-5 Stories)"
CECBH,"Concrete, Engineered Commercial Building, High-Rise (6+ Stories)"
SPMBS,"Steel, Pre-Engineered Metal Building, Small"
SPMBM,"Steel, Pre-Engineered Metal Building, Medium"
SPMBL,"Steel, Pre-Engineered Metal Building, Large"
SERBL,"Steel, Engineered Residential Building, Low-Rise (1-2 Stories)"
SERBM,"Steel, Engineered Residential Building, Mid-Rise (3-5 Stories)"
SERBH,"Steel, Engineered Residential Building, High-Rise (6+ Stories)"
SECBL,"Steel, Engineered Commercial Building, Low-Rise (1-2 Stories)"
SECBM,"Steel, Engineered Commercial Building, Mid-Rise (3-5 Stories)"
SECBH,"Steel, Engineered Commercial Building, High-Rise (6+ Stories)"
MHPHUD,"Manufactured Home, Pre-Housing and Urban Development (HUD)"
MH76HUD,"Manufactured Home, 1976 HUD"
MH94HUD-I,"Manufactured Home, 1994– HUD - Wind Zone I"
MH94HUD-II,"Manufactured Home, 1994– HUD - Wind Zone II"
MH94HUD-III,"Manufactured Home, 1994– HUD - Wind Zone III"
